{"authority":{"trusted_pass":false},"basis_binding":{"artifact_hash":"sha256:cccccccccccccccccccccccccccccccccccccccccccccccccccccccccccccccc","registry_binding":{"arm_hash":"sha256:92623e9272fe929694ea063a51350740fada0879ee7ba1368af53608447cee11","arm_id":"typescript.production.v1.source@1","registry_hash":"sha256:4e4aa59c25c1c43257eb946de2aa0a99ad0ac193ad21b72a64f2163a1ec99a51","registry_id":"reviewgraphen.source_review_registry.r2","tuple_hash":"sha256:30b5b7ed971d9bad50164563cef086488781f36870e0c12863aa023bcf186a55"}},"coverage":{},"execution":{"context_projection":"unavailable","mode":"enumerate_and_defer","reviewer_execution":"not_run","verifier_execution":"not_run"},"extraction_binding":{"artifact_hash":"sha256:dddddddddddddddddddddddddddddddddddddddddddddddddddddddddddddddd","registry_binding":{"arm_hash":"sha256:92623e9272fe929694ea063a51350740fada0879ee7ba1368af53608447cee11","arm_id":"typescript.production.v1.source@1","registry_hash":"sha256:4e4aa59c25c1c43257eb946de2aa0a99ad0ac193ad21b72a64f2163a1ec99a51","registry_id":"reviewgraphen.source_review_registry.r2","tuple_hash":"sha256:30b5b7ed971d9bad50164563cef086488781f36870e0c12863aa023bcf186a55"}},"ingestion_binding":{"artifact_hash":"sha256:eeeeeeeeeeeeeeeeeeeeeeeeeeeeeeeeeeeeeeeeeeeeeeeeeeeeeeeeeeeeeeee","registry_binding":{"arm_hash":"sha256:92623e9272fe929694ea063a51350740fada0879ee7ba1368af53608447cee11","arm_id":"typescript.production.v1.source@1","registry_hash":"sha256:4e4aa59c25c1c43257eb946de2aa0a99ad0ac193ad21b72a64f2163a1ec99a51","registry_id":"reviewgraphen.source_review_registry.r2","tuple_hash":"sha256:30b5b7ed971d9bad50164563cef086488781f36870e0c12863aa023bcf186a55"}},"obligation_partition":{},"obligations":[],"plan_partition":{},"registry_binding":{"arm_hash":"sha256:92623e9272fe929694ea063a51350740fada0879ee7ba1368af53608447cee11","arm_id":"typescript.production.v1.source@1","registry_hash":"sha256:4e4aa59c25c1c43257eb946de2aa0a99ad0ac193ad21b72a64f2163a1ec99a51","registry_id":"reviewgraphen.source_review_registry.r2","tuple_hash":"sha256:30b5b7ed971d9bad50164563cef086488781f36870e0c12863aa023bcf186a55"},"request_id":"request:fixture","run_id":"run:fixture","schema":"reviewgraphen.generic_review_run.v5","source_trace":{}}
